<?xml version="1.0"?>
<!-- 
This grammar contains a lexicon and categories for giving route directions.

Copyright (C) 2006 Michael White
$Revision: 1.2 $, $Date: 2006/05/20 20:34:16 $ 
-->

<grammar name="routes"
  xmlns:xsi="http://www.w3.org/2001/XMLSchema-instance"
  xsi:noNamespaceSchemaLocation="../grammar.xsd"
>

  <lexicon file="lexicon.xml"/>
  <morphology file="morph.xml"/>
  <rules file="rules.xml"/>
  <types file="types.xml"/>
  <tokenizer replacement-sem-classes="direction landmark num ord person place road turn"/>

  <LF-from-XML>
    <transform file="../treeify-lists.xsl"/>
    <transform file="../convert-to-hlds.xsl"/>
    <transform file="../core-en/add-chunks.xsl"/>
  </LF-from-XML>

  <LF-to-XML>
    <transform file="../core-en/raise-nodes.xsl"/>
    <transform file="../convert-to-graph.xsl"/>
    <transform file="../simplify-lists.xsl"/>
  </LF-to-XML>

</grammar>
