<?xml version="1.0"?>
<!-- 
Copyright (C) 2003-5 University of Edinburgh (Michael White) 
$Revision: 1.9 $, $Date: 2005/07/22 21:09:23 $ 
-->
<grammar name="flights"
  xmlns:xsi="http://www.w3.org/2001/XMLSchema-instance"
  xsi:noNamespaceSchemaLocation="../grammar.xsd"
>

  <lexicon file="lexicon.xml"/>
  <morphology file="morph.xml"/>
  <rules file="rules.xml"/>
  <types file="types.xml"/>
  <tokenizer replacement-sem-classes="airline airport amt city date dur
    fareclass num person scalar time timeframe"/>

  <LF-from-XML>
    <transform file="../core-en/derive-features.xsl"/>
    <transform file="../treeify-lists.xsl"/>
    <transform file="../convert-to-hlds.xsl"/>
    <transform file="../core-en/add-chunks.xsl"/>
  </LF-from-XML>

  <LF-to-XML>
    <transform file="../core-en/raise-nodes.xsl"/>
    <transform file="../convert-to-graph.xsl"/>
    <transform file="../simplify-lists.xsl"/>
    <transform file="../core-en/drop-features.xsl"/>
  </LF-to-XML>

</grammar>

